<?xml version="1.0" encoding="UTF-8"?>
<!-- edited with XMLSpy v2008 rel. 2 sp2 (http://www.altova.com) by Adi Rabinovich (AT&T) -->
<!-- DTD generated by XMLSpy v2008 rel. 2 sp2 (http://www.altova.com) -->
<!-- Don't forget to use &gt; and &lt; for greater than and lower than, can be followed with equal like this  &lt;= -->
<!ELEMENT statement (#PCDATA)>
<!ATTLIST statement
	code CDATA #REQUIRED
	clientObject CDATA ""
	type CDATA "Default"
	debug (Yes | True | No)  "No"
	description CDATA ""
	paramsRequired (true | false)  "true"
>
<!-- "type" attribute is made dynamic, and it maps to Pool name, but has some recognized exceptions, like RefBean -->
<!ELEMENT sql ((statement+))>
<!ATTLIST sql
	type CDATA #REQUIRED 
>